<?xml version="1.0" encoding="UTF-8"?>
<xs:schema xmlns:xs="http://www.w3.org/2001/XMLSchema" xmlns="http://opennebula.org/XMLSchema" elementFormDefault="qualified" targetNamespace="http://opennebula.org/XMLSchema">
  <xs:element name="VMTEMPLATE">
    <xs:complexType>
      <xs:sequence>
        <xs:element name="ID" type="xs:integer"/>
        <xs:element name="UID" type="xs:integer"/>
        <xs:element name="GID" type="xs:integer"/>
        <xs:element name="UNAME" type="xs:string"/>
        <xs:element name="GNAME" type="xs:string"/>
        <xs:element name="NAME" type="xs:string"/>
        <xs:element name="PUBLIC" type="xs:integer"/>
        <xs:element name="REGTIME" type="xs:integer"/>
        <xs:element name="TEMPLATE" type="xs:anyType"/>
      </xs:sequence>
    </xs:complexType>
  </xs:element>
</xs:schema>
